,seccion,dias,no,cuenta,nombre,email_institucional,I1.INT,I2.CM
0,1000,Sa,1,20131013804,DANIEL MAURICIO ACOSTA ORTEGA,dmacosta@unah.hn,0,0
1,1000,Sa,2,20141000857,MERIE ALEJANDRA BANEGAS RODRIGUEZ,merie.banegas@unah.hn,0,0
2,1000,Sa,3,20141003775,ABRAHAN WILLIAN RODRIGUEZ CARTAGENA,awrodriguez@unah.hn,86,42
3,1000,Sa,4,20151002176,ROQUE ANDRE KURWAHN LEIVA,roque.kurwahn@unah.hn,86,42
4,1000,Sa,5,20181000913,ALEX ANDRES CASTILLO REYES,alex.castillo@unah.hn,0,0
5,1000,Sa,6,20181006424,CRISTHIAN JOSUE RAPALO ESPINO,cristhian.rapalo@unah.hn,0,0
6,1000,Sa,7,20201002877,KEVIN JOSUE PEREZ LAGOS,kjperezl@unah.hn,86,42
